2868	0	a	Both companies have competitive prices , but Comcast gives you more bang for your buck , in my opinion .
2869	0	a	First - my deepest and most sincere condolences at the loss of your mom .
2870	0	a	Id love to know what you think to keep my melee game strong .
2871	0	a	Unless we agree to exchange feedback and you can read my script that is 98 pages long .
2872	0	a	It allows for the distinction , and highlights your challenges in arguing against our specific state and society .
2873	0	a	I'm not saying don't expect things , but at least temper some of your expectations from this company .
2874	0	a	I am going to respond as a worst-case scenario story for you .
2875	0	a	If you're still clinging to a rebellion that failed 150 years ago get the fuck out of our country .
2876	0	a	melody is awfully familiar , but your faux lyrics mess up my thinking process .
2877	0	a	And about last night , I agree with you 100 % , last night was atrocious .
2878	0	a	It might be better over here , but you're pretending that we have gender parity when we don't .
2879	0	a	But you can have any knowledge base and not care about people as evidenced by our current political issues .
2880	0	a	It sounds more like she didn't want to talk to you .
2881	0	a	I refer you to our prior discussion about the importance of thinking about details of proposed policy .
2882	0	a	If we had done what you want you'd eventually have a rural versus urban societal imbalance and even conflict .
2883	0	a	We will be happy to help you navigate our government to reach your goals .
2884	0	a	Again , i doubt you consider a basset hound your equal from those standards .
2885	0	a	I can share my experience with you , though .
2886	0	a	Downvote me all you want , but make an argument against the medical journals and not my personal experience .
2887	0	a	I regret being so ambivalent in my original post , you're totally wrong .
2888	0	a	Strength training and toning is , in my own experience , when your belly really starts to change .
2889	0	a	Now mind you , we do get a lot of clueless husbands and boyfriends .
2890	0	a	bro you would not believe the idea I just had for WM .
2891	0	a	That's nice great-grandpa we love you .
2892	0	a	i'm afraid it's you that has no understanding of the issue .
2893	0	a	Sorry for your perception of my pretentious language , I'd rather talk good than bumble through with bullshit .
2894	0	a	First i appreciate the minimalist approach , but you are one major step away !
2895	0	a	Thank you so much for taking the time to read my post and share this !
2896	0	a	Best thing to do is to find your own resonance frequency in my opinion .
2897	0	a	Here , let me spell this out for you An Airplane Smashed The fuck Into it Jesus Christ .
2898	0	a	( I'm not saying * you * were doing that , but I've seen it on here before ) .
2899	0	a	For this sort of thing you can generally just keep adding more computers to get it done faster .
2900	0	a	If you're matched together , i'd say 98 % of the time you belong in the same lobby .
2901	0	a	thank you for starting my day with a genuine chuckle .
2902	0	a	I weirdly resented my experience but what you just said makes a lot of sense .
2903	0	a	we're both in agreement that identitarianism is bad , but you seem to think it's just white nationalists .
2904	0	a	From my perspective the main difference is whether you are providing separation , or traffic information .
2905	0	a	This is just my observation based on your guys ' interaction with the community .
2906	0	a	i'm not sure why you think forcibly taking away my access to land no one built is morally ethical .
2907	0	a	I swear Netflix doesn't * want * you to know what they have .
2908	0	a	Very classy of you to try to politicize her death .
2909	0	a	I love how hard you are trying to ignore the fact that our actions have consequences .
2910	0	a	Together , with all of you , we have worked to make higher education affordable and accessible .
2911	0	a	We will add your biological distinctiveness to ours .
2912	0	a	We love seeing our community help one another and hope you would do the same !
2913	0	a	From the bottom of my heart , thank you so much for your kind and gracious reply ! !
2914	0	a	But in my classroom , you need to speak correct English because that's what I'm expected to teach you .
2915	0	a	Ok . For some reason got this idea in my head that you were somehow banned from playing in your meta .
2916	0	a	But this has been my experience of general attitudes with little to make me feel incorrect besides your claim .
2917	0	a	Thank you for helping me along on my Friday morning .
2918	0	a	Sounds like your biggest problem is consistency and sticking with it .
2919	0	a	Since you seem concerned , I'll give you my take on it .
2920	0	a	i hate those other red bats worse , you can't interrupt their attacks by melee .
2921	0	a	Thank you kind lady stranger , there will always be a place in my heart for you .
2922	0	a	All so they can use that information to market more crap to you ?
2923	0	a	While we disagree on the abortion issue I do understand your mixed feelings about the death penalty .
2924	0	a	If we lose that ’ s a strong argument against keeping Caldwell , something many of you want .
2925	0	a	On a secure building you care enough about to encase on a planet wide force field .
2926	0	a	And you're right it is our laws and morals .
2927	0	a	I haven't played the game yet , only seen gameplay , but that seems like something you'd be interested in .
2928	0	a	I can tell your commitment to logic by the way you male up my beliefs .
2929	0	a	I do volunteer sorry if that makes you mad i help the poor more than your self righteous ass .
2930	0	a	If any big company bids on this , I bet you it's some international corp from some place like Dubai .
2931	0	a	Look at the dialog : * * JAKE : * * We weren't supposed to divulge this , but since you left us no choice .
2932	0	a	As someone who lives in the UK I can tell you that socially we have not adjusted well at all .
2933	0	a	Just so you don't misunderstand my intentions , I'm hugely supportive of the LGBTQ community .
2934	0	a	I feel what matters most to the Massively Online thing is how other players affect you ( through the economy , mainly ) .
2935	0	a	Thank you random person on the internet for clearing up my personal feelings on texting and driving for me .
2936	0	a	If you're getting an entry level job , i want you to have those skills .
2937	0	a	So you very clearly have ulterior motives from the start .
2938	0	a	Disliking Kanye is fine but complaining about his music if you clearly haven't heard it is pretty lame
2939	0	a	But it's okay , we love you !
2940	0	a	I may not agree with you at all , but I understand the philosophy .
2941	0	a	From my experience , therapy is really beneficial as an ongoing process - even if you don't go often .
2942	0	a	I appreciate your feedback however , I want to make sure we are understanding each other .
2943	0	a	I'll miss the post game threads with you oiler bros . See ya in 14 days lol :(
2944	0	a	i study music history / theory / philosophy , so i can give you some good recommendations !
2945	0	a	This may shock you , but most companies are small companies .
2946	0	a	Thank you for putting my feelings into words .
2947	0	a	My wife , daughter and I never answer the door unless we know you're coming , and everyone knows it .
2948	0	a	When you make a claim that is impossible it does undermine your credibility , that's my only point .
2949	0	a	But , I can offer my sincere sympathy for your situation .
2950	1	a	I'm older than most of you here , but I think this is a really fun event .
2951	0	a	I assumed you had a DUI or cheated based on your title .
2952	0	a	Hearing either side of this argument is annoying , but here we are yet again because your side started complaining first .
2953	0	a	Wow thank you for the insight i will research into lovebombing .
2954	0	a	I am part of the EU , you are part of the EU .
2955	0	a	I want you to say a homeless person would be the best choice .
2956	1	a	This is not the height of my humor ( you may note I never made a joke ) .
2957	0	a	You're doing the lords work my friend , thank you for all you do !
2958	0	a	Thank you for the discussion my friend .
2959	0	a	Let me tell you something , This show hasnt even begun to peak .
2960	0	a	I can pull you up the stats later , but when both candidates debated , it resulted in Bernie gaining more traction .
2961	0	a	We waited 4 years for it and you guys blew through it in one day .
2962	0	a	I think you're missing the point , someone asking if you're high is just pointing out that they know you're high .
2963	0	a	The Church is for saints and sinners alike and we would love for you to worship with us .
2964	0	a	I'm a trained and qualified professional , I don't have time for your gamesmanship just to get * noticed * .
2965	0	a	You are an amateur , and on July 8th , I will send your ass to the shadow realm .
2966	0	a	I feel like you saw right through my weak attempt to mask my sense of jealousy and isolation .
2967	0	a	So byy my left leaning logic you are a racist .
2968	0	a	Furthermore you people should understand that FISA section 702 allows us to spy on OTHER COUNTRIES not our own .
2969	0	a	Calling me an asshole for acknowledging my own selfishness while simply saying your own selfishness is different is childish .
2970	0	a	That's only if you consider the status quo to be the best things we can move towards .
2971	0	a	That's the story I heard anyway , you can Google it for more info .
2972	0	a	post traumatic sex disorder if you lurk here , we're here for u man
2973	0	a	As far as the math advisors telling you that you can't take 1172 , I think that's BS .
2974	0	a	We're not your enemy , but you sure think we are .
2975	0	a	Thats literally what we all work for so I'm not sure what answer they would expect your answer to be .
2976	0	a	- genuinely interested in your struggles / triumphs - genuine in general ... we show our true colors .
2977	0	a	Otherwise you might have seen where I explain my position and agree to the limits of its utility .
2978	0	a	I'm also tired of you dismissing my arguments as me being obtuse and unhelpful , ad nauseum .
2979	0	a	I can see how this would be the norm if you have a high deductible plan .
2980	0	a	In my experience the pen issues only affect you if you are a digital artist and need precision .
2981	0	a	I'd say spending some time over on / r / personalfinance and having some serious discussions about your finances are in order .
2982	0	a	I would start by isolating the variables influencing your recordings .
2983	0	a	I think you gotta give credit to their seniors and captains though .
2984	0	a	All the stuff he tells you as you work your way to him , it just made a lot of sense .
2985	0	a	But we both know you are being willfully ignorant and are trying to spread a disinformation campaign .
2986	0	a	Anxiety insomnia sucks and you have my sympathy .
2987	0	a	Despite your country of origin , we are here now , under the same banner of freedom and equality .
2988	0	a	Afghanistan's Mountains are what you have to watch out for .
2989	0	a	https://tealswan.com/resources/articles/why-you-cant-leave-the-relationship-intermittent-reinforcement-r210/ It is harder to leave a toxic relationship because of the highs that we get addicted to .
2990	0	a	It might just be the photo , but I think your foundation may be * slightly * too yellow for you .
2991	0	a	You seem to be confusing my criticism of your behaviour with acceptance of psychiatry .
2992	0	a	You are too childish and stubborn to actually counter my points so you resort to calling anything feelings .
2993	0	a	Thank you for your support , we sincerely appreciate it .
2994	0	a	While what you say is true , makes no sense to insult one of our own .
2995	0	a	If we buckle down and work through lunch , we'll get released early Edit : thank you kind stranger .
2996	0	a	It's hard sometimes to remember that we were all young once ;-) Again , thank you for sharing .
2997	0	a	Oh my god , your comment is so fucking sweet and wholesome .
2998	0	a	You are welcome to work on any projects you would like in our friendly and helpful environment .
2999	0	a	Lady you look awesome and I love that pattern on you .
3000	0	a	If you're lazy and not doing your job well , you won't be given hours .
3001	0	a	If i disagree with you , we now have two different beliefs .
3002	0	a	I needed this in my life right now , thank you .
3003	0	a	Yes , your insults and assumptions about my intelligence have shown me the light .
3004	0	a	i win your best friendship .
3005	0	a	Regardless , we are being pedantic and don't disagree with the other points you said .
3006	0	a	Glad we're done with your emotional rant .
3007	0	a	I send my love and good vibes to you and your beautiful family !
3008	0	a	The deal was always clear - you provide safety and facilities , we'll pay for that in taxes .
3009	0	a	Every day write what you did and how it pertains to your topic .
3010	0	a	I'm an editor with WUFT news and I'd love to speak to you about these PM's .
3011	0	a	Have a great day and we look forward to your continued support of our other augmented reality games !
3012	0	a	As long as we express our excitement in a way that's more comfortable for you , it's all good .
3013	0	a	We will add your small business ' distinctiveness to our own .
3014	0	a	It's confusing to me that you'd attach nuance to the troubles but not to what we're facing today .
3015	0	a	Our corn has our own personal genetic blueprint that makes it impossible to contest your spot .
3016	0	a	Of course you know about his ability to investigate and of course you know better than our Intelligence committee .
3017	0	a	You decimate our technology sector , you can't develop most software without access to the internet .
3018	0	a	Thank you either way for giving back to our community !
3019	0	a	Also you used quite disrespectful language towards the team and were pretty negative about our chances .
3020	0	a	I struggle with anxiety and depression as well and just seeing all that you've accomplished absolutely made my day .
3021	0	a	I've been in the same place as you , the constant criticism destroyed my self confidence .
3022	0	a	but you need the idealized person to hate and thinking i'm more complicated would blow your pea-sized brain .
3023	0	a	Long story short , I don't think you can ask that question in a way that they'll say yes .
3024	0	a	Because if you are cool with Russia meddling in our elections then you re supporting a foreign power .
3025	0	a	I thoroughly enjoy it , and you can get it for pretty cheap these days .
3026	0	a	I write responses for my benefit , teaching something always makes you go over your thought process in depth .
3027	0	a	Beyond the pedantry , you have established no relationship between the state of our economy and such inequality .
3028	0	a	All I can tell you is that I'm honest about my beliefs .
3029	0	a	Don't you DARE infringe on that toddler's 2nd Amendment right to bear arms !
3030	0	a	If you want to play PC games ( which we all do ) then you install Windows .
3031	0	a	No , I'm genuinely interested in your opinion on crowd size since you said you were at both .
3032	0	a	Runecrafting in my world is a way to channel magical energy and shape it to your desire .
3033	0	a	It's not only creepy , but against your wishes of what she does with your possessions !
3034	0	a	If not , you can call the police and they'll tow it after two days .
3035	0	a	It's very clear to me that you people have never played yugioh before .
3036	0	a	When you get money dropped on you like that , it actually sucks , well at least for me .
3037	0	a	If you don't want to do Purina , I also like Victor food a lot .
3038	0	a	In my opinion you should never bring up a random strangers or acquaintances weight or physique .
3039	0	a	When I was doing CPR training , we had a feedback machine that shows how deep you pressing .
3040	0	a	Idk about you but even if I don't catch anything I absolutely love spending a day out on the water .
3041	0	a	Make sure you've put some lemon juice over the pear to prevent browning .
3042	0	a	Now you can imagine why we fight so hard against anti-Asian bias and racism on kulturemedia .
3043	1	a	you know , it's kind of funny because my mind instantly went to the left instead of the alt-right .
3044	0	a	I feel like when she paused it , you should've known that she would come back to it .
3045	0	a	I feel sorry for you guys in non free states .
3046	0	a	I as a business major understand that you have to differentiate our product from someone elses .
3047	0	a	Working on yourself empowers you to do better work in the world in our shared predicament .
3048	0	a	Thought you might've enjoyed some light ribbing of our rivals .
3049	0	a	Be careful : debt sucks , but losing your sanity and becoming a curmudgeonly , jaded tech sucks more .
3050	0	a	I used to be compared to you all the time back when you were on Skins .
3051	0	a	I've always loved to cook and hope you'll forgive my propensity to keep posting what I'm cooking .
3052	0	a	I'll offer some advice , not that you have to respect my opinion at all .
3053	0	a	in doing some more research i am fairly confident now that you are right .
3054	0	a	and before more bullshit fake concern happens , yes I dont want your help now
3055	0	a	We are also not responsible for your self esteem or for validating you with compliments .
3056	0	a	I hope you're here with us for the long haul ❤ ️
3057	0	a	I only want to argue if you mean engage in civil debate for the benefit of both our minds .
3058	0	a	I know that doesn't mean shit to you since we have different opinions pertaining to excessive weight .
3059	0	a	Good luck to you and my condolences
3060	0	a	I know you're busy with your life and that may be contributing to our lack of conversation .
3061	0	a	Regardless of the result , compared to our playoff performance you've shown you truly deserve to be here .
3062	0	a	There's already one there , we're already the United States , you don't need to unite what's already united .
3063	0	a	I've never neglected my pets though , thank you very much .
3064	0	a	If the answer is no ( which I think it is ) then trade his ass for whatever you can get .
3065	0	a	We already have a radar that fully details the map you're playing along with enemy positions ( when visible ) .
3066	0	a	A lot of your post focuses on how others see the fandom .
3067	0	a	I would have given her one with just water in it if you already knew she'd shoot you early !
3068	0	a	Thank you for everything you've done to inspire my life and my work .
3069	0	a	I can feel it and you can catch a nail on it .
3070	0	a	I hope your daughter tells and shows you how proud she is .
3071	0	a	So from the bottom of my heart , thank you all for being so welcoming !
3072	0	a	What you have said is so full of wroung information it caused me pain .
3073	0	a	It's a cool story , if I were you I'd regret getting rid of it
3074	0	a	Anxiety sucks , you have my sympathy .
3075	0	a	The thing is , this is your living situation we're talking about .
3076	0	a	I think you're doing a great job and certainly keeping my interest .
3077	0	a	The mentality of Fuck you , my interests are the right interests .
3078	0	a	You're also told that if you fail , your family will be killed or tortured .
3079	0	a	what we see with your words is part of the mindless cynicism that helps the plutocrats win .
3080	0	a	If you ignore what the MSM says , it seems our diplomatic relations with other countries have improved .
3081	0	a	But I don't see anything really wrong with doing it your way either .
3082	0	a	I just appreciate polite discourse on Reddit so cheers to you my man .
3083	0	a	God damnit why is your uni education so much better than ours .
3084	0	a	Because you are your body , you are not a skin encapsulated ego .
3085	0	a	I think he is suggesting that you should hold for long enough to make sentiment-driven market fluctuations meaningless .
3086	0	a	Ironically , you have a mediocre 3-3 record against us in our recent ' rivalry . '
3087	0	a	I agree with your legal assessment but I don't agree that he considered anything other than her age .
3088	0	a	I wish you health , happiness , and trust in our institutions .
3089	0	a	Thank you for making my teen years so awesome man .
3090	0	a	Now you are just showing your ignorance of the context surrounding our constitutional history .
3091	0	a	Seriously , thank you anonymous , I'm a big fan of your Fawkes masks and how you're woke as fuk .
3092	0	a	I'm gonna be totally honest with you ; I have no clue how this works ( I'm pretty new ) .
3093	0	a	I don't think you're being dramatic , I definitely would have expected the rest of my original order !
3094	0	a	A lot of it contradicts my understanding and you admitted to not even living in the UK to experience .
3095	0	a	Are you upset at me or mad because you're fat ?
3096	0	a	Should've guessed , but I gave you the benefit of the doubt .
3097	0	a	Thank you good sir for doing it and proving my eyes were not deceiving me .
3098	0	a	Wow , you make me want to hang out with you while you're listening to CCR .
3099	0	a	I'm not about to discuss anything so personal as my real life job with you depraved strangers !
3100	0	a	Regardless of your worldview , there is an insane amount of faith required to look beyond our current existence .
3101	0	a	* * - - - You are here * * And if it was , I didn't mean it .
3102	0	a	2 ) I don't care the circumstances , you should never drive if you aren't of age .
3103	0	a	Not gonna be offended by anything you write , so don't worry about hurting my feelings .
3104	0	a	Hope you'll enjoy probably my favorite anime .
3105	0	a	i dont understand what could possibly be shameful about your feelings .
3106	0	a	I suggest you take your own advice and get help with the issues .
3107	0	a	I agree with you that we should bring civility back into politics .
3108	0	a	But thank you for reminding me that it's not an optional one .
3109	0	a	In my experience , there is a wide variety of personalities you will find in cats dogs .
3110	0	a	i hope you're telling these things to your fellow believers , though .
3111	0	a	Not my fault you ’ re too fucking stupid to realize the obvious fact that Trump supporters are racist .
3112	0	a	My advice is just keep doing what you're doing , advocate for our community as a cis-ally .
3113	0	a	Idk why to be honest , I've frankly never met you in my life .
3114	0	a	But we already know actively using your phone in any capacity is likely more dangerous .
3115	0	a	In my experience , askreddit is where you go when you have a question about people's experiences with something .
3116	0	a	I am your coworker and want to keep our relationship professional .
3117	0	a	And if we wanna base masculinity on such toxic ideals , you're weak and short as fuck .
3118	0	a	given that you are a successful professional politician - i don't think either of those are true .
3119	0	a	Whilst I appreciate that there's a financial stability element to this , trust that things will work out for you .
3120	0	a	I don't even know how you could so willfully misinterpret my comment .
3121	0	a	I love this sub , you people are beautiful and fantastic and make me appreciate my curls even more .
3122	0	a	Thank you for opening my eyes , and for the love of god open your eyes .
3123	1	a	I laughed out loud and so did my husband at calm your tits Sheryl .
3124	0	a	Neither you nor your state have the right to impose such conditions upon me without my consent .
3125	0	a	A bedrock of the constitution is parliamentary sovereignty , ie , you do what we say and like it .
3126	0	a	As individuals with autism , we cannot stand to see our server besmirched with your continued presence .
3127	0	a	If you feel unable to do this , I think you need to seriously reconsider your relationship .
3128	0	a	And you know , he's integral to keeping our defense together .
3129	0	a	my good sir / ma'am : I disagree with your level of anger .
3130	0	a	So many of your egos seem to manifest in putting a boot on my face .
3131	1	a	Oh my you have such a genuine smile !
3132	1	a	Then I thought it was a joke that climbing too much ruins your personal life and led to a divorce .
3133	0	a	I'm a hispanic guy and I totally get if dark haired brown dudes aren't your thing .
3134	0	a	I think because you're fair ( like me ) the dark super heavy lashes look too much .
3135	0	a	you're attempting to establish moral high ground by oddly insinuating i'm persecuting victims of anorexia because i merely disagree .
3136	0	a	Only thing I can speak to is your first point .
3137	0	a	I understand your frustration and firmly believe she shouldnt be allowed to keep the child .
3138	0	a	You see , I have an issue with the fact that it is technically just a popularity contest without actual competition .
3139	0	a	But we heard your feedback - we understand that you see the new map as an almost separate mode .
3140	0	a	I think the connection would be already made when you pick the target device and the popup shows on it .
3141	0	a	Your family has my condolences , for what little it's worth .
3142	0	a	Maybe you can discuss the tattoo with your husband in a therapy session .
3143	0	a	I think you have a decent thought , but honestly some heroes are better alone compared to others .
3144	0	a	Hey , thank you for coming to my defense .
3145	0	a	I'm not sure where you live , but absolutely none of the police officers near me dress in camouflage .
3146	0	a	no , like i said I generally agree with you .
3147	0	a	Guy says let's play again but this time you need to spot me balls .
