1439	0	a	If you walk out right now and my manager makes me pay for this This is illegal pretty much everywhere .
1440	0	a	It's disingenuous and detracts from our ability to take you seriously .
1441	0	a	So we both condemn slavery and you're still a bigot .
1442	0	a	anyway i love that you love the female body too !
1443	0	a	Saying and your friends is a false equivocation and an intellectually lazy attack of my character .
1444	0	a	I hope it does not increase my anxiety like you because my anxiety is already so bad .
1445	0	a	Unlike you , though , my friends are in happy relationships .
1446	0	a	I feel like you cant criticize it yet cause its not out .
1447	0	a	just run chmod + x [ whatever . sh file you need to run ] . sh this should make it executable .
1448	0	a	http://lifehacker.com/5977082/what-documents-should-i-shred-and-what-should-i-keep Usually keeping documents is most important when you are starting or closing a relationship .
1449	0	a	I'm not leftist , but you might wanna take a better look at the situation
1450	0	a	I trust my faith , you trust you're knowledge .
1451	0	a	In any case , the core of my advice was that you should acquire a solid background in mathematics .
1452	0	a	Since your point is equally valid we have to compromise in real life .
1453	0	a	I'd buy you lunch to make up for it but you probably wouldn't eat anything .
1454	0	a	I genuinely thought this was miss you in the satisfaction up until now .
1455	0	a	If you're well versed in dealing with computers , be my guest .
1456	0	a	You're just fuming because your imperial japan style nationalism has bern triggered by my comment .
1457	0	a	i hope you use safe words and he knows what he is doing .
1458	0	a	Snuff has very high sp and doctrine requirements , so if you're there being told to change ship wouldn't surprise me .
1459	0	a	Oh , my dear friend , you have a good soul and a lot of hope .
1460	0	a	Some people ( my church included ) believe that is the rejection of Jesus that condemns you .
1461	0	a	Congrats & you make my heart smile 😊 Thank you for raising awareness on SMA , love !
1462	0	a	I'm sure you've heard these tips before , but I'll say them anyway bc they've really helped me .
1463	0	a	As always , your comments are a welcome sight on my poetry .
1464	0	a	Honestly good luck to those of you who do run and especially good luck to the two that win .
1465	0	a	Don't let it worry you - - in fact , I'd be proud of him .
1466	0	a	I won't be disrespected for sharing my opinions when I respect yours .
1467	0	a	I just wanted to let you know that I hope you have a wonderful day !
1468	0	a	I only want to argue if you mean engage in civil debate for the benefit of both our minds .
1469	0	a	I've also seen your twitter account call out people for selling coins .
1470	0	a	your lived experiences as an individual are irrelevant because my illiberal , collectivist ideology says so .
1471	0	a	My favorite thing about my INTP friends is that subtlety you don't get with a lot of other people .
1472	0	a	But I won't abide by your misrepresentation and strawman of our issues .
1473	0	a	We are total strangers but it warms my heart to hear your words of sage advice and personal testimony .
1474	0	a	What do you think basically every left leaning newspaper has been doing ?
1475	0	a	I think you are mistaking my ability to express myself for some kind of emotional outburst .
1476	0	a	I hope you do not take my hostility personally .
1477	0	a	Thank you , by the way , for validating my feelings about ss's penis comment .
1478	0	a	And again you are asking me to go against my knowledge and experience to support your idea .
1479	0	a	It doesn't mean that all of mankind needs to bend to your personal preferences .
1480	0	a	I used to work at a detail shop and you're 100 % correct .
1481	0	a	You can't worm your way out of bigotry by saying my bigotry fights bigotry .
1482	0	a	I am in no way trying to doubt your relationship , it is just some food for thought .
1483	1	a	Those funny noises that you hear coming from stomach is my IBS having fun with me .
1484	0	a	If so , I would be happy to listen to your input and we can engage in civil debate .
1485	0	a	It's interesting you say that you think my PRs get better as I go up in distance .
1486	0	a	Thank you for furthering my understanding of your position .
1487	0	a	If you've got a black dog , good luck wearing white
1488	0	a	I'm not an expert on the immigration process though , so you're probably right about being extremely vetted .
1489	0	a	I'm sorry if we miscommunicated , but our invite was only for you two .
1490	0	a	I'm curious , how do you decide who's deserving medical assistance ?
1491	0	a	I'm not going to argue about how much the queens existence benefits our economy because unfortunately you are wrong .
1492	0	a	But if you think you will like it , get it .
1493	0	a	I touch the Bream of my Carp in your direction .
1494	0	a	If people were actually capable of instrumental rationality as you describe we wouldn't be having this conversation right now .
1495	0	a	Putin will respect me AAHAHAHAHAHAHAHHAHAAAA Do you respect the footstool you stand on ?
1496	0	a	Any midwife / OB worth their shit will see you regardless of what day it is .
1497	0	a	It wasn't our choice and you damn well know it .
1498	0	a	Conceding ground readily where you are wrong tends to make you look better , in my experience .
1499	0	a	own it , which you have in words , but really own it , which it sounds like you are .
1500	0	a	I've been rethinking my relationship very similarly to yours .
1501	0	a	I'm guessing if you squeeze it when empty , it creates suction .
1502	0	a	You got a downvote but I know what you mean .
1503	0	a	My SIL would probably follow suit because , you know , mommy is always right .
1504	0	a	Gonna be completely honest with you : my girlfriend and I love these types of threads .
1505	0	a	Unless you've also changed what the notification bar looks like , I still think we use different androids .
1506	0	a	You also need to take a citizenship test and prove that you know about our country's history .
1507	0	a	I feel like you're trying to have sex with my ear .
1508	0	a	I'd deconstruct or sell any of the weapons you pick up .
1509	0	a	Hey man , I really appreciate your enthusiasm and your willingness to try to educate our community .
1510	0	a	From my perspective you ’ re ok with him having sex with other people .
1511	0	a	Watching pro players and popular streamers can help you learn strats and it actually really improved my skill level ...
1512	0	a	In my humble experience , it can definitely reduce your dating pool versus presenting as a cis male .
1513	0	a	i was being sarcastic , but sincerely you have convinced me that nothing matters and there is no point .
1514	0	a	Honey , you said you wanted my honest opinion .
1515	0	a	Also , what is organized and logical to me might seem jumbled to you .
1516	0	a	He was never top class but if you make it a decade anywhere I suppose you deserve it .
1517	0	a	Thank-you I very much appreciate the kind words and insights ... I'll pm you my details .
1518	0	a	So I have a feeling you are going in the wrong direction with the self esteem thing .
1519	0	a	i find myself culturally superior to you in many contexts .
1520	0	a	My wife and I are incredibly excited for the November release and we appreciate all of your hard work .
1521	0	a	I don't know why you're not getting the attention you crave ; I'm not around you or watching you .
1522	0	a	Dude , from a 16 years old bisexual guy , i find you really attractive , like , really .
1523	1	a	Hahaha that's hilarious , and i feel you .
1524	0	a	Also as an American , I think you misjudge people and are incorrect in thinking it's solely an anti-American sentiment .
1525	0	a	Sending all my love and support to you .
1526	0	a	Bonus points if you can somehow disguise yourself as benevolent mythological figures .
1527	0	a	Alot of any advice we could give you would depend on what position you play in .
1528	0	a	It's so easily ignorable like all the other things that you don't care for .
1529	0	a	Totally stealing your joke to impress my family with how witty I am .
1530	0	a	i am being more rational than you , given that you are equating mild racism with white supremacy .
1531	0	a	people are responsive to questions in my experience , and get you what they described .
1532	0	a	I want to see race reports , damn it , not your 5 threads asking my opinion on running shoe colours .
1533	0	a	Thank you for the advice , though , it does put my little anxious heart more at ease
1534	0	a	Thank you so much for answering all my questions , very much appreciated !
1535	0	a	I was just politely implying you don't have to watch .
1536	0	a	I'll give you black , grey , white , or red but come on now .
1537	0	a	Right , you seem well-informed , so clearly you're aware of how popular our dear leader is .
1538	0	a	If the doctor wrote it , who are you to say no ?
1539	0	a	If you're not going to live in the city proper , I'd recommend Seattle over NYC .
1540	0	a	you also need a husband who isn't going to emotionally abuse you for doing what normal people do .
1541	0	a	If you commit crimes , we violate your financial autonomy or your bodily autonomy by fining or jailing you .
1542	0	a	I'm not sure what else you could possibly think people use them for .
1543	0	a	It's not my fault if you have a hard time understanding implied metaphor .
1544	0	a	If you want straight guys to respect our sexual orientation , then we have to respect theirs .
1545	0	a	And if you cannot be bothered enough to do that , well you just shouldnt be a mod .
1546	0	a	Never mind mate , as you can tell from this thread , needs must .
1547	0	a	Other then my personal issue , I wish I could up vote you more then once .
1548	0	a	Activity rates were horrendous however when our mission president tried to replicate your's success it failed miserable .
1549	0	a	Honestly i hope you find joy and compassion your life .
1550	0	a	I won't even return your email if you're asking me to hold the rental for you .
1551	0	a	I really , very much , appreciate and I am so grateful for all your offers .
1552	0	a	You bastards :P you know that's not what I said .
1553	0	a	I'm also glad that we have you in our community .
1554	0	a	And i respect your individual freedom of choice to do so .
1555	0	a	I salute you my friend
1556	0	a	ALL of my female friends love reading too , so I really don't know where you formed your opinions .
1557	0	a	No problem for you , but that user gets frustrated , pissed , annoyed because it doesn't ' work right ' .
1558	1	a	By which I don't mean four pans , but I'll take one off your hands .
1559	0	a	Like we might worship the same God , but my perception of God may be different than yours .
1560	0	a	He's of that calibre , in my opinion , and I hope the experience is as rewarding for you !
1561	0	a	The respect I have you TTUN and it's fans fuels my deep hatred .
1562	0	a	I'm reading the article to mean that if you buy your phone outright it would be unlocked .
1563	0	a	I had similar issues as your husband an still struggle sometimes with my family .
1564	0	a	That said , my advice would be to not worry about the historical accuracy of your background .
1565	0	a	i'm saying economic despair can force you to act in ways that wouldn't under stability .
1566	0	a	I've felt absolutely sick with sadness this evening , but your new kitty video warms my heart a little .
1567	1	a	But thank you for giving me something wonderful to take my mind off of it .
1568	0	a	Writing a letter on a piece of paper is no where near what you could do with a computer .
1569	0	a	You have my most sincere condolences on the loss of your father .
1570	0	a	I don't share the same understanding of our economic systems as you do .
1571	0	a	Oh my lord , you are hilarious .
1572	0	a	💗 I can't imagine my life without you silly puppy !
1573	0	a	But do continue on the odd occasion , we are very much liking your talent .
1574	0	a	Since you have an extensive biological framework for this we can go straight into the facts .
1575	0	a	I think you're missing the fact that the quote is taken word-for-word from an email sent by Trump Jr .
1576	0	a	If it is going from . 4 to . 55 then you can sometimes ignore that .
1577	0	a	Though I understand if you didn't get to the part where they excuse legal borrowing .
1578	0	a	I thank you my friend .
1579	0	a	i hope you get help with emotional support .
1580	0	a	The inability for you or anyone else to see and respect that is not my responsibility .
1581	0	a	Stop taking advantage of my reckless twitter exclamations that corroborate your investigative evidence !
1582	0	a	While your experience may be positive , we also have a lot of first time psychosis induced experiences here .
1583	0	a	I nonetheless salute you for making me aware of this crucial piece of popular culture .
1584	0	a	They're really annoying injuries , my sympathies to you .
1585	0	a	thanks for reminding me how good i have it compared with the likes of you :) peace .
1586	0	a	I will repay your random act of kindness with one of my own :)
1587	0	a	But you're right , we can't really hold the government to account for being disingenuous antidemocratic fuckwits .
1588	0	a	Look over at / r / sirifail and you'll see just how awful Siri has become .
1589	0	a	Take responsibility for the fact that you saying that you knew my sexual history was not acceptable .
1590	0	a	I'll tell you that here we don't see ethnic violence between Palestinian and Israeli people .
1591	0	a	And i guarantee you wouldn't be any different .
1592	0	a	The nationalism we are talking about isn't being proud of your nation .
1593	0	a	But to answer your question , we have very little knowledge as to what happened during this period
1594	1	a	It's different because we're mocking you !
1595	0	a	I'm happy that you are not in charge of this sub .
1596	0	a	At your age I was still with the girl I started dating sophomore year of high school .
1597	0	a	Keep your portions only as large as they need to be .
1598	0	a	The fact you asked if religion played a part in my viewpoint on climate change is a bigoted argument .
1599	0	a	I think I kinda understand why that would upset you but could you elaborate ?
1600	0	a	But in terms of those specific three , from what i know sounds like itll work out good for you
1601	0	a	I hate guys who are so fucking rude to you when you ask if they're using a certain weight etc .
1602	0	a	You're right , I was asking the wrong question and I hope you can forgive my blasphemy and unbelief .
1603	0	a	It's a shame really , you'd think for a betrothed couple we'd know what each other looks like .
1604	0	a	Not sure what tutoring your doing but our kids have been in Kumon for the past year .
1605	0	a	And your kind words about my boob magic is [ humbling .
1606	0	a	The only reason I stay on kiss is because you guys have the best selection and most active community .
1607	0	a	Thank you for adding larva wagon to my insult vocabulary .
1608	0	a	And my coworker said No , thank you .
1609	0	a	Give watermelon a try on the BBQ and you'll never look back .
1610	0	a	Actually say I'm sorry , my credit can't handle your generous gifts .
1611	0	a	i'm giving you genuine feedback here : don't ask for feedback when nothing works .
1612	0	a	As a geography and history major , i of course agree with you wholeheartedly .
1613	0	a	He reminds me a little of my partner , and a lot of what annoys you I find endearing .
1614	0	a	Its hard to tell people that you won't help them without coming off as being rude at times .
1615	0	a	Whatever fits your headcanon and makes you at peace with your feelings , my friend .
1616	0	a	As an Irishman , I duty bound to tell you that Patty is short for Patricia .
1617	0	a	Our bodies don't detect hypoxia at all , and with a pure N2 bag you'll keep expelling CO2 just fine .
1618	0	a	The overwhelming majority of our violent crime occurs in our cities and you're spreading false propaganda btw .
1619	0	a	All he did was provide FACT BASED EVIDENCE that you're probably wrong .
1620	0	a	In economics we call this the sunk cost fallacy - - you have better opportunities available .
1621	0	a	However , you're right that our monkey brains need interaction with humans .
1622	0	a	I will always love my boy Miller , and you guys are fun to watch .
1623	0	a	It's a shit situation since you have gigs to play , but try to be flexible with him .
1624	0	a	You have your faith and we have ours .
1625	0	a	Which tells you everything you need to know about the intelligence level in my state .
1626	0	a	Thanks for showing me what you're talking about and confirming my suspicions .
1627	0	a	Thank you for sharing and fulfilling my curiosity about the sign !
1628	0	a	Hope you wake up to the outright misogyny and internalized mysandry that dominate that sub soon .
1629	0	a	Thank you all for the kind words , it ’ s been rough , especially for my mom .
1630	0	a	I hope to see all of you move up and advance your skulls to the next level !
1631	0	a	Whatever we are : Atheist like me , Muslim like you , Christian , Jewish or whatever .
1632	0	a	If you think the police just randomly picked people up , then you're wrong .
1633	0	a	I'mma let you finish , but a script blocker is the best extension of all time - - * of all time * .
1634	0	a	I appreciate your optimism my man !
1635	0	a	On all our behalf I say thank you .
1636	0	a	I just feel like you guys still to this day fundamentally don't get what's going on here .
1637	0	a	You have to have evidence of the streamer themselves saying they're viewbotting or else there is nothing you can do .
1638	0	a	Also , I'm pretty sure you can't adapt HDMI into USB C , the adapters are all single-direction USB C to HDMI .
1639	0	a	I'm not a lawyer , so I don't understand your question .
1640	0	a	There are some rational precautions that we as a society can take regardless of your belief system .
1641	0	a	In my opinion , the legal split between what you can and cannot discriminate against is internally inconsistent .
1642	0	a	It sounds like you are dealing with extremely similar issues to our new addition .
1643	0	a	And thank you for the information about my mala , I truly appreciate it .
1644	0	a	Knowing a little more context , i can give you better advice : 1 .
1645	0	a	It brings tears to my eyes every time I watch the opening and you don't even know the characters .
1646	0	a	How about , it is my opinion that you should pursue therapy .
1647	0	a	I am surprised you found someone to even fiance that .
1648	0	a	If you all could pitch in , I would greatly appreciate it .
1649	0	a	How are you seeing more Snake Eyes and Hagejin than Itazan exactly ?
1650	0	a	If you want those extras above basic food and shelter then work .
1651	0	a	Appreciate your continued support and we'll be fighting hard this weekend !
1652	0	a	I appreciate you asking a question and trying to gain information on the matter .
1653	0	a	In some way we're both some kind of stereotype , and that how you build a character .
1654	0	a	You're going to love my morals so much , you will want them for yourself .
1655	0	a	Pretty safe assumption in context of my other replies here , despite your shock and outrage lol .
1656	0	a	Thank you for the comment about my parents feeling fulfilled by my very existence .
1657	0	a	Just because you associate Aboriginals as all needing welfare cheques doesn't mean we're all as racist as you .
1658	0	a	And thanks again for your encouragement to not regret my decision to say something to them too early .
1659	0	a	I would love your feedback on how i can make it better .
1660	0	a	Fall is better , if you skip the god awful life and death brigade part .
1661	0	a	Well then , do I have a once-in-a-lifetime opportunity for you !
1662	0	a	I want that to sink in for you , since you clearly believe that this child knows what is happening .
1663	0	a	Now you say it's okay to condone that kind of violence because we're trying to overthrow him .
1664	1	a	i'n sorry for not catering to your particular sense of humor and standard of quality .
1665	0	a	Maybe reading your writing will improve my sexy time writing .
1666	0	a	It might be different in your city , but in my experience this is a case of confirmation bias .
1667	0	a	but i'll humor you : - i don't like any religions .
1668	0	a	If you fail at your job a good union won't protect you .
1669	0	a	man , thank you for writing this , I think i'm going through something similar .
1670	0	a	We're using the firm CEB to manage our training if that helps push you in the right direction .
1671	0	a	I wish she would analyze your library , and try to fit that with what she hears you say .
1672	0	a	I love hearing from all of you and keeping tabs on how everyone is doing .
1673	0	a	I hope you stay around and read and see what's up .
1674	0	a	How do you reconcile your belief we are moving to an authoritarian / fascist state because of Trump .
1675	0	a	I would rather be wrong and obedient to my mother than right and with you .
1676	0	a	But I'd rather be honest with you right out of the gate .
1677	0	a	Suck my filthy shit stained dick you humorless fucking cunt , cheers .
1678	0	a	Go talk to your older relatives , the casual racism in my families elders is pretty impressive .
1679	0	a	It's rare in our busy world , and when you find alone time , enjoy .
1680	0	a	Hopefully my position also makes sense to you too .
1681	0	a	FIRST YOU TOOK MY VIDEOGAMES , NOW YOU ARE TAKIN MY HOLLYHISTORY .
1682	0	a	Go do some primary school reading comprehension exercises before you go white knighting on my comments .
1683	0	a	Ohhhh my god thank you for posting that .
1684	0	a	Just because i have a different sense of humor than you doesn't mean i'm a shill .
1685	0	a	But I appreciate your dickish , sarcastic reply to my post that had neither in its tone .
1686	0	a	Let me get my big gulp to catch your bitter , salty tears .
1687	0	a	You can find some Spec . B Legacy sedans in the US , but I don't believe they brought the wagon .
1688	0	a	I suggest before coming into park since most rookies think theyre goats already anyway , atleast upgrade your player to 75 .
1689	0	a	I say this a lot , but as a parent , you really need to trust your own instincts .
1690	0	a	You made an erroneous assumption about my knowledge , I corrected you .
1691	0	a	We hope you learned a bit more about our reporting and tracking Islamophobia .
1692	0	a	Society has progressed and realized we can't discriminate based on how you were born .
1693	0	a	Not the you disagree with my political views kind .
1694	0	a	You would never know I had a genius IQ if you looked at my overall GPA and criminal history .
1695	0	a	But my assumption would be you still need to * show proof of insurance * .
1696	0	a	Aren't you just wearing it too tight if you're getting a rash ?
1697	0	a	Ahh , thank you for putting words into my mouth .
1698	0	a	Wish we could impart some of your perspective on them .
1699	0	a	in my experience dongles are by nature ephemeral fleeting things that break when you aren't paying attention .
1700	0	a	I freaked , I was like WTF ARE YOU DOING HERE , GO TO THE HOSPITAL !
1701	0	a	I understand what you're saying , but I disagree with some points , and i agree with others .
1702	0	a	I think the decks you listed are the exceptions , even in modern .
1703	0	a	Republicans , like you said , control our country now .
1704	0	a	To whom you're born , or the location , would have no influence in my perfect world .
1705	0	a	It never came up in conversation outside of , we really love your dedicated work experience etc .
1706	0	a	I didn't say they didn't suffer , obviously my condolences for your family .
1707	0	a	All you are doing is guaranteeing the worst of our society will go into teaching with this bullshit .
1708	0	a	Maybe if we did it more , society would fit your narrow worldview a bit better .
1709	0	a	You basically wrote my inner monologue for this past year .
1710	0	a	How can you look at that goal and not think it was a bullshit call .
1711	0	a	I went a little in depth , but i love the tune and hopefully you will love it too .
1712	0	a	Let me tell you I am so much happier of a person .
1713	0	a	One thing I discovered is that when you grew up suicidal , like pre - 18 , your mind grows up around it .
1714	0	a	As such , we desire a beneficial relationship , and want to hear how you imagine this working .
1715	0	a	We didn't intentionally cheat Aiken out of millions of dollars ( Casey Close deserves your ire ) .
1716	0	a	But thank you for reminding me how far we still have to go in getting true professionals in place .
1717	0	a	That brings a lot of peace to my mind thank you .
1718	0	a	I have good new for you , based on my own experience .
1719	0	a	But we love each other and it is nice to know your partner can empathize with the pain .
1720	0	a	But i would say it doesn't align with community wants , but I agree with the other points you've said
1721	0	a	Words can't express how wonderful you're helping make this Christmas for my little ones !
1722	0	a	I also like how you got real racist at the end with calling immigrants cavemen .
1723	0	a	I'm pretty irritated by the condescending and childish approach you have to my faith .
1724	0	a	Thanks for coming to visit and for all your wonderful compliments about our state .
1725	0	a	I don't particularly care if you trust my account of the story .
1726	0	a	I know you're going to respond aggressively to me but you need therapy .
1727	0	a	As long as you don't disrespect me or try to change my views where cool even if we disagree .
1728	0	a	I'm proud that i was fortunate enough to enjoy your hard work .
