4279	0	a	Thank you very much for doing your part to educate our country's youth .
4280	0	a	From my experience it's just a way to show love , hospitality and that you care for someone .
4281	0	a	All you need to do is test for each outcome at least once .
4282	0	a	So i agree with you , the US does meddle in other countries elections .
4283	0	a	Hope your friend ends up loving RL like we all did
4284	0	a	I know that everyone is different but I want to share my story with you because it's fairly similar .
4285	0	a	Mods can allow your comments and posts to be seen .
4286	0	a	Unfortunately ( whether or not you support Trump ) it turns out our democracy is not infallible .
4287	0	a	I would love to have natural big boobs like you to fill in my clothes better .
4288	0	a	A sad result of a mentality among some that my ignorance is as good as your knowledge .
4289	0	a	Thank you again for my gift , you're very thoughtful 💋
4290	0	a	Your boyfriend had the courage and trust in you to be honest with you , and you react this badly .
4291	0	a	Thank you my Reddit friends for this experience and hope to keep sticking around !
4292	0	a	In all seriousness you are my hero .
4293	0	a	your counselor in college is not helpful beyond teaching you how to enroll in my opinion .
4294	0	a	I and my belief system hate that you have a point .
4295	0	a	After your post was removed we implemented the flair filtering system to try to relax the standards .
4296	0	a	I also link often in groups related to our topics , which you need to take care when doing .
4297	0	a	Like you , I also really enjoy history and my university degree choice was between History and Psychology .
4298	0	a	Thank you for answering all my quesitons
4299	0	a	and my understanding is completely the same as yours .
4300	0	a	I would suggest , having learned your lesson , that you should support his businesses , rather then boycott them .
4301	0	a	The first thing you see is my Grandma smiling and laughing with my Dad .
4302	0	a	If you enjoy killing unlawfully I hope you enjoy being a fugitive .
4303	0	a	Sorry for my ignorance and thank you again for your advice !
4304	1	a	I hoped you'd appreciate my humor , but alas ...
4305	0	a	I would be honored to employ your voice talent services to solicit monitors in my region .
4306	0	a	I'd warn you against taking anything posted in iamsmart at face value .
4307	0	a	Make sure you're in Florida , Michigan , Wisconsin , Ohio , Iowa , NC , Pennsylvania or any of the usual red states though .
4308	0	a	I guess it's off to the gulags for you my friend for your hatred and intolerance .
4309	0	a	I find it sad that you think what that family went through is not scary enough for you .
4310	0	a	In the spirit of transparency I will share my contribution to that discussion with you all .
4311	0	a	I'm not trying to defend the other poster's position , i'm just giving you the information that is relevant .
4312	0	a	Hey , I like good storytelling podcasts , and my playlist looks eerily similar to yours .
4313	0	a	It blows my mind you would rather trust a company with a profit motive than the government .
4314	0	a	I feel this way because everytime you gave an inch they take a mile and then trash you anyway .
4315	0	a	Thanks for your acute knowledge of my life though .
4316	0	a	In my experience you really need one or two friends to develop a circle of friends .
4317	0	a	But you say that we should respect law .
4318	0	a	I find your general understanding of my central argument regarding subjective patient responsiveness to be shallow at best .
4319	0	a	And as for those personal questions , you have to be careful you don't hurt my feelings .
4320	0	a	Go ahead and judge me , but bring some Miracle Whip when you do !
4321	0	a	It's been my pleasure , you beautiful Trek judging stranger .
4322	0	a	Plus you're right , we mostly care about LT's voice acting .
4323	0	a	I'd like to remind you and all Blue Jays fans about the robbery that was the Josh Donaldson trade .
4324	0	a	I think you can blame the Bourne movies for this .
4325	0	a	It's my belief that in common areas you have no expectation of privacy .
4326	0	a	From my point of view , you can teach the basic missionary lessons .
4327	0	a	Your actions suggest that you feel your time is of greater value than our time .
4328	0	a	Man thank you .. my best friend has fell sick to this culture within the last year .
4329	0	a	Thank you so much for supporting our band and making it such an amazing experience and life event !
4330	0	a	So thank you for this comment and reminding me that mindfulness is important to our relationships ! !
4331	0	a	The new knowledge opens your eyes to the horrors of our carnistic society .
4332	0	a	It also covers if a company sends you two of something you only bought one of .
4333	0	a	So you could say that Canada as we know it — ten provinces and three territories — is turning 18 .
4334	0	a	Better idea : we let him return , and send you to Sudan .
4335	0	a	Now if you have anything good to share about the role of support be my guest and share .
4336	0	a	You're obnoxious , annoying , and oh my GOD I love that you got banned .
4337	0	a	If you've ever done that for them , thank you from the very center of my heart .
4338	0	a	I'm suggesting that's the narrative he has in his own head about how to hook you .
4339	0	a	If you have the space in your fridge , I say yes .
4340	0	a	Hun , it's not him who needs to change , it's you .
4341	0	a	And , typically that will kill her if she is de-meched in the middle of your team .
4342	0	a	Thanks for your opinion I disagree I believe neuer would improve our defense with his distribution greatly .
4343	0	a	I agree with you , but at the same time , we have done a number on communism .
4344	0	a	and he said ' Because I'm trying to give you a fucking physical . '
4345	0	a	You know it's wrong to intimidate people when you are sober so do not drink !
4346	0	a	Edit : I want to add to this by asking you a question .
4347	0	a	I admit this because you a most likely correct about my hatred of corporations .
4348	0	a	This isn't financial advice , but I work in psych and we get people like what you described .
4349	0	a	You have your truth , I have my truth .
4350	0	a	You have me quite convinced now , I'll have to try it when I get a chance !
4351	0	a	He said my son your time has come and , this is your lesson in pride !
4352	0	a	It wasnt a long film but i felt your characters showed a lot of depth and emotion .
4353	0	a	I doubt you're going to get a response for this .
4354	0	a	Then you reply basically shaming me for my views ( what the original comment said conservative friends do ) .
4355	0	a	I am just stunned reading all of these replies , you have got to be shitting me .
4356	0	a	If the way you like to have sex hurts her , what do you expect her to do ?
4357	0	a	Talking is not going to work - in fact , I'd bet it will only dig your grave deeper .
4358	0	a	It looks like you chose the ideal fabric , but I can't identify it from the photo .
4359	0	a	For the reasoned one , you dont understand that we share 90 % of virtues with Chrisitanty .
4360	0	a	I offer you my sincere apologies .
4361	0	a	Hey , I'm just writing this because it fascinates me that people like you manage to find food and shelter .
4362	0	a	If you apply the very same logic your_best_friend have used , no , we should not .
4363	0	a	If you set it up and maintain control of the frame , like we do .
4364	0	a	But you're right , we can't live in a world where someone is guilty until proven innocent .
4365	0	a	The mentality of Fuck you , my interests are the right interests .
4366	0	a	Clearly you are one of the most influential critical thinkers of our time .
4367	0	a	Bring your commanding officer here after this meeting , so we may coordinate that .
4368	0	a	Because with my experience of life , you always get rational coming from rational not irrational or nothing .
4369	0	a	I remember a few years back one of the reporters commented that ' obesity affects the way you run ' .
4370	0	a	As you know Jeremy Corbyn rebelled against the Blairites and was marginalised for our sins .
4371	0	a	i think it's reasonable to question your relationship and willingness to commit to a year-long lease .
4372	0	a	I guess I'll have to talk to my advisor but thank you
4373	0	a	I should not have to defend my private actions to sate your insecurity .
4374	0	a	If you hadn't derailed this with namecalling and other general immaturity we could have had a very nice discussion .
4375	0	a	This , whatever you call it , is my new political affiliation .
4376	0	a	Thank you all for answering my post .
4377	0	a	Haha , my friend , surely you jest !
4378	0	a	The Dragonknight is my favorite for that purpose , some of the skills really help you control the field .
4379	0	a	I guess you prefer to leave out the bits that don't support your bullshit .
4380	1	a	Accidentally texted my female boss I love you .
4381	0	a	Add to the estimation that you have a motivated buyer and an unmotivated seller .
4382	0	a	They cannot say if you nourish your beautiful tummy as you should .
4383	1	a	Oh it's hilarious that you think we need to manufacture violence .
4384	0	a	Dude you have just singlehandedly figured out the solution to all our socioeconomic situations .
4385	0	a	Then , I want you reconcile how that works with the civil rights laws we have .
4386	0	a	If you 6 or 8 lane I - 70 through the mountains , you invite a wave of additional people up every weekend .
4387	0	a	I understand what percentages are , you're awfully condescending for someone asking for our opinions .
4388	0	a	All you have proved is that Muslims foment violence , which is something we already knew .
4389	0	a	This is the only advice you need , though I advise against sending pertinent emails to personal email addresses .
4390	0	a	i'm glad that you're ( at least outwardly ) ignorant instead of racist .
4391	0	a	If you can clear them out we can work together to make this country amazing .
4392	0	a	) , and that your work doesn't address the widespread , systemic nature of racism in our country .
4393	0	a	I agree that we can come up with simpler solutions such as yours .
4394	0	a	I think less of you because you stood by silently while he labeled Mexicans as criminals and Muslims as terrorists .
4395	0	a	Sending you loving hugs from my heart .
4396	0	a	The app is probably perfectly accurate and I would bet you are being cheated on .
4397	0	a	I am a beginner at this stuff but I think I can offer you advice via my experience .
4398	0	a	You may have lost faith in yourself , but we never doubted you .
4399	0	a	First of all , if something is bothering you , you need to communicate .
4400	0	a	Let me tell you a story : Last night I had sex with my girlfriend of 18 months .
4401	0	a	unfortunately the same dipshit has exhausted my ability to give your reply the consideration it needs .
4402	0	a	If you can think of better way I'd like to hear it !
4403	0	a	For those who have friends and family members like chipsNtoes and others , my heart goes out to you .
4404	0	a	Feel free to come back and leave comments if you have ideas , I'll ready everything in my inbox .
4405	0	a	All you can do is make you happy and hope that he will be able to do the same .
4406	0	a	I hope your learning goes on as unimpeded as possible .
4407	0	a	If you didn't tell Sony you wanted to me Keep your project then this wouldn't have happened .
4408	0	a	I completely feel you on this , except I did the opposite .
4409	1	a	And also fun is subjective , we don't know what fun for you .
4410	0	a	If everyone takes the same stance as you we'll never overcome our differences .
4411	0	a	I don't care if it's accurate in your opinion , I'm asking why you said it .
4412	0	a	Seriously , John Williams , 7 episodes and you still can't think of something new ? ? ?
4413	0	a	You are so worthy of love and you deserve all of my love and support right now .
4414	0	a	I honestly can't figure out what you were going for with this logic .
4415	0	a	Yup can't wait watch my wealth nosedive because you extremist are unwilling to compromise .
4416	0	a	I agree with everything you said , but I want to cut the OP a little bit of slack .
4417	0	a	We appreciate the fact that you like our beer , and the friendly dialogue on the matter .
4418	0	a	And in general you erode our moral high ground .
4419	0	a	I concur with all you've said , and thank you for adding context to my earlier post .
4420	0	a	I think Nancy was very insecure about her ring when it was compared to yours .
4421	0	a	But the more you see that , the more you also realize we're pretty similar underneath it all .
4422	1	a	Love your comics , the humor is right up my alley .
4423	0	a	Often these couples are doing things for each other , the little I-Love-You things , that may not be obvious .
4424	0	a	I mean , you said it's not a great neighborhood , so perhaps that's a bad idea .
4425	0	a	I like the FIFA model of only allowing you to use women's teams against other women's teams .
4426	0	a	i'm sorry that i hurt you feelings with imaginary karma .
4427	0	a	Pls take my upvote and unwavering confidence that you are the man and it simply wasn't meant to be .
4428	0	a	I respect your decision on the topic ; one that wouldn't be my choice .
4429	0	a	I still hate the fact that we lose ranks in matches when you're out numbered .
4430	0	a	I Thank you all for our wonderful moments .
4431	0	a	I appreciate you taking your time to comment such a fine contribution to my life .
4432	0	a	Its not my fault you fail to understand how the real world works , stay in school kid
4433	0	a	We all know why you posted this , and we love our gay MAGA supporters .
4434	0	a	Not my fault you're having an whinge against some perceived oppression .
4435	0	a	I agree with you in that I was expecting a better intro to 8th in the rule book .
4436	0	a	But the only real money is if you are an expert or specialist , i . e .
4437	0	a	hire a private investigator ( i'm sure you know a few ) and get the answers .
4438	0	a	My chinchilla attacks the vacuum the same way your rabbit attacks the broom .
4439	0	a	And in my opinion , mushrooms can be an enormous help with processing your thoughts and feelings properly .
4440	0	a	Most of you guys were very helpful and supportive of my over the top role playing ! ! !
4441	0	a	While my questions were rhetorical thank you for the detailed answers .
4442	0	a	Even though we don't agree , I understand your views and I find them reasonable .
4443	0	a	If you aren't smart enough to connect the dots then you have no business questioning my intelligence .
4444	1	a	http://i.imgur.com/vKm89US.jpg Have fun with the hobby and make the minis yours
4445	0	a	So it stands to reason that you would be even angrier over illegitimate criticism - my example .
4446	0	a	Thank you to your country for hosting me last weekend .
4447	0	a	So when he says something like Your pussy feels incredible , you might just respond with a moan .
4448	0	a	Interesting to me that your criticisms of the genre haven't really applied to Kemet in my experience .
4449	1	a	I don't get the joke in your original comment , but the edit is funny .
4450	0	a	I hope you have the chance to value and process my input .
4451	0	a	You have communicated clearly , you did what any rational person would recommend .
4452	1	a	i hope you CRY MORE at me , it's fucking hilarious .
4453	0	a	I'm always self-conscious about my smile so thank you !
4454	0	a	No thank you , that was an ample compliment on my character !
4455	0	a	Cultural differences are natural , and i don't think a good basis for breaking away from your home country
4456	0	a	I'm taking it out on you because I see this shitty low effort wank all over smaller subs .
4457	0	a	If you're just trail / dayhiking , you don't need to worry too much about ankle support .
4458	0	a	Thank you to our pets for giving us purpose outside ourselves and a special type of love .
4459	0	a	* * [ Dee proceeds to trash the bouncer for a full minute ] * [ Bouncer ]: * Are you with her ?
4460	0	a	What you posted really flashed me back for a sec .
4461	0	a	Don't use my post to outsource your ' drug and crime free ' sphere of influence .
4462	0	a	Oh my goodness thank you so much for your thoughtful responses , they really mean a lot thank you .
4463	0	a	I just tweeted him , I'll let you know what he says .
4464	1	a	I love my wife , but your 30 ' s could have been a lot of fun .
4465	0	a	Well you're about to go on an epic fucking musical journey my friend .
4466	0	a	I honestly appreciate your thorough response to my question .
4467	0	a	I admire your restraint in the heat of the moment .
4468	0	a	Treat people with respect and you'll get it in return my friend .
4469	0	a	I don't know how you know that but I'm going to believe it from now on .
4470	0	a	I really appreciate that you'd be willing to consider a separate version to fit with our rules here .
4471	0	a	But now that we know the core of the issue , I fully understand where you're coming from .
4472	0	a	And , no my analogy still makes sense if you consider how dominant both the warriors and SKT are .
4473	0	a	We don't trust the fkn magic money industry that has made you rich and destroyed our parents and grandparents .
4474	0	a	I'm sorry your dad has anger issues , my dad did as well growing up and it was awful .
4475	0	a	She said you're my best gay not gay friend .
4476	0	a	But you're right , let's remove parts of other cultures because my culture is offended by it .
4477	0	a	On the other hand , you didn't say this explicitly but you imply that you're mono \ * \ * \ * ous as well ?
4478	0	a	I saw the disapproval amid other emotions you mentioned as my marriage began to suffer tremendously .
4479	0	a	I imagined it would be over in two years or so You can imagine what you like .
4480	0	a	Your critical thinking skills are seriously lacking if you really think that was my argument .
4481	0	a	Like you said , sounds kind of dorky but she ’ s my best friend .
4482	0	a	Thank you for this civil conversation , I hope we can continue it .
4483	0	a	In the vast majority of cases , however , you are not required to tip .
4484	0	a	i'm not sure polygamy is what you meant , since that specifically means having multiple wives .
4485	0	a	i'd love to see the contract where you think these exchanges happen though .
4486	0	a	It was my belief you were attacking translater and that just struck me as being hypocritical .
4487	0	a	I'd never bother posting if it weren't entirely sincere , so you're right , my befuddlement was heartfelt .
4488	0	a	Also , how do people think those Jeffery Dahmer glasses make you look like anything other than a sex offender ?
4489	0	a	I would suggest the secrecy in our government disputes your assertion .
4490	0	a	me and my partner are both of the same nationality but I share your feelings .
4491	0	a	Pls tell me your autismo stories to make me feel better
4492	0	a	I'm not so sure why you think that after 19 weeks of fitnessing you should be coaching anyone .
4493	0	a	I get your frustration but saying our midfield has been bad is objectively wrong .
4494	0	a	It all depends on whether you think her internal emotional states are like ours .
4495	0	a	In my experience is doesn't matter what conditions you add in the description / title .
4496	0	a	If you want ideas that would be more personalized , we would need more information .
4497	0	a	That's ok . We do not have a socialist country and despite your opinions , our laws still matter .
4498	0	a	So Doug what do you think of Marsh deck I hate it !
4499	0	a	The vocal minority makes you think we do .
4500	0	a	If you are an attractive , popular , happy and well-loved guy , my apologies .
4501	0	a	I mean , this is the person you're looking at naked for the rest of your life .
4502	0	a	You are a very talented young man Thank you for accepting my friendship on facebook .
4503	0	a	I'm sorry you hate women , but we as a sex aren't to blame for your loneliness and pain .
4504	0	a	Truth though : thank you for bringing this to my attention .
4505	0	a	Where you're at with this is solid if we grant that the idea and the word are inextricably linked .
4506	0	a	Nobody blames you and we will all move forward together , as Americans .
4507	0	a	The store has zero legal obligation to provide you a * * new * * phone in exchange for a * * broken * * phone .
4508	0	a	Thank you man , it's my pride and joy .
4509	0	a	In my experience , the value in a masters degree isn't when you are starting out .
4510	0	a	You know what I love , is if you go back to the pilot episode ?
4511	0	a	however , i welcome it and thank you again for your input as it's actually constructive .
4512	0	a	Undermining the equality of our relationship because of double standards that work in your favor .
4513	0	a	It blows my mind that you're concerned about media honesty when more things he says are lies than truths .
4514	0	a	Arbitration : Yeah , based on the evidence we have , we think Goodell is right , you're suspended .
4515	0	a	I can't tell you how much I appreciate this post today .
4516	0	a	But it also has an interesting feature which you didn't suggest , but might end up being in my bridge tunnel .
4517	0	a	In my eyes , that makes Tenacity the worst possible meld you could choose .
4518	0	a	You can stay with her knowing that things won't change , or you can break up with her .
4519	0	a	What you said is completely irrelevant and not based on anything actually said .
4520	0	a	I will check out the links you provided , I am interested in learning about my attachment style .
4521	0	a	For the record , * you * are the Democrat example of the flawed mentality I'm talking about .
4522	0	a	I agree with you , there is a lot of misinformation in this thread .
4523	0	a	I love your kids but I feel like my time isn't being respected .
4524	0	a	And I'd actually wager you wouldn't run into problems in most places here - this isn't Mississippi or anything .
4525	0	a	Culturally , we have a completely different mythology and ancient history from you .
4526	0	a	Thank you so much for your response , and my apologies in the delay getting back to you .
4527	0	a	I only know how to give you what I learned in my experience .
4528	0	a	Well , except the pens , I don't know what you mean by that .
4529	0	a	I appreciate , your openness in answering my questions .
4530	0	a	It says you will have a higher chance of medical issues .
4531	0	a	The only justified anger in our rivalry this year is us being angry with you .
4532	0	a	No we weren't , you're just a racist buttinski with shitty logic and poor arguments .
4533	0	a	I think you're right about the Penguins , they have a good spread .
4534	0	a	The end to my subjective experience is the presence of the implication of another's : namely yours .
4535	0	a	Thank you so much for your help , we really appreciate it ! !
4536	0	a	We would love to have your perspective in our University to enhance our student's education .
4537	0	a	make sure you respond with facts and that is all you need to worry about .
4538	0	a	Good jawline , masculine features , and i like your eyes , they say a lot !
4539	0	a	Thank you for being a part of our community !
4540	0	a	It amazes me that when you buy a gun , you are not given mandatory lessons in gun safety .
4541	0	a	I don't know what to say other than if something like that happens again , you should probably just reveal .
4542	0	a	I'm also sorry for your loss , no matter how we lose people the grief is always overwhelming .
4543	0	a	Thank you for another day and for the many blessings in my life , especially my friends and pets .
4544	0	a	I hope you aren't deceiving our users in order to split the Democratic tickets in future elections .
4545	0	a	All you've proven is my point : hatred works great for destroying things .
4546	0	a	This game has a strange obsession with making your character all powerful even if we never did a thing .
4547	1	a	Have fun and remember , the world could always use more heroes , glad we found one in you .
4548	0	a	The only reason we haven't killed ourselves ages ago is because of the morality that you disdain .
4549	0	a	Thats how we know you genuinely love our country and want to be apart of our family .
4550	0	a	I am sending you a virtual hug and my best wishes .
4551	0	a	So if you ask me who the best QB ever is first place I'd look at is the individual awards .
4552	0	a	If someone's here in good faith expressing something from a feminist viewpoint we expect you to engage accordingly .
4553	0	a	And keep honest , we * need * that , and you , * for * it .
4554	0	a	Immaterial though you ’ re a useful idiot actively undermining our system every day you support 45 *
4555	0	a	We all hope the best for you and we totally understand your feelings of sadness and hopelessness .
4556	0	a	It's hard to stay hopeful and to remember my own existence , but thank you so much .
4557	0	a	Feel free to disregard my pervious comment that vaguely insinuated that you're a homophobe .
4558	0	a	We demonstrated our friendship in the strongest possible way by never targeting you .
4559	0	a	I'm pretty sure furries know more about furry than you do my good dood .
4560	0	a	Thank you for making me smile person with a different political stance than my own .
4561	0	a	Even if you want to use a different adjective , we still agree .
4562	1	a	its funny we all laughed as you guys getting outraged over nothing .
4563	0	a	All that bullying did was forced you into the closet and reinforced my bad behavior .
4564	0	a	It's science you idiots , it doesn't need your belief to be true .
4565	0	a	So from all of us , we sincerely thank you and appreciate your kind words !
