0	0	a	Not my problem , you're wrong your beliefs are racist end of story .
1	0	a	I agree with you all based on what we see .
2	0	a	another factor that kind of screws you over is that our phone plans are HEAVILY geared towards family plans .
3	0	a	A marriage counselor can help you account for a context that we online people can't .
4	0	a	Tailoring my workload so it is doable in this timespan is your responsibility .
5	0	a	Thank you for the detailed information , i really appreciate it .
6	0	a	I love the assumption of my character just because I'm offering a differing mindset to yours .
7	0	a	This is because you do not understand the U . S . A . We are the United * * STATES * * of America .
8	0	a	To begin , I agree with you that the reality we experience we know exists concretely .
9	0	a	Its not our job to educate you when it seems like youre not asking in good faith .
10	0	a	But regardless of that , you are still ignoring the crux of my argument .
11	0	a	We want our site to be your home for viewing our content .
12	0	a	If it helps you to feel less lonely , then i am happy to help a fellow human being
13	0	a	i hear it gets better after you manage to actually teach them how to be a human being .
14	0	a	Also thank you for answering my questions and being extremely helpful .
15	0	a	I reject your attempt to paint my criticism as cynicism .
16	0	a	But when you're freedom to fail starts to affect other's freedoms , then we have a conflict .
17	0	a	Especially having the confidence in your self , no better feeling in my opinion .
18	0	a	But , yea your probably right , we would be better off with another politician with minimal economic experience .
19	0	a	Thank you for the guidance and answers to my questions !
20	1	a	https://i.imgur.com/YJy9Slm.jpg I've been wanting to share this because it's hilarious , thank you for giving me the opportunity .
21	0	a	For most other shrubs and trees though , you'd use the rooting hormone powder .
22	0	a	It is wonderful that you're still so innocent to believe other countries as so desperate for our products .
23	0	a	And I hope to see every single one of you at / r / wtt_graduates at some point !
24	0	a	Patriotism in my opinion is an ability to be proud of your nationality , your country .
25	0	a	I mean if his feelings are hurt it's okay to tell your SO you're upset and you should .
26	0	a	Propping up corrupt governments in poorer countries and fighting proxy wars is our shtick thank you very much .
27	0	a	Thanks , I also appreciate that you responded respectfully to my criticism .
28	0	a	She wants you to make a plan and propose it .
29	0	a	I hope you learn to be better in the future , but you've lost access to my attention .
30	0	a	If you liked the feel check my other shit , it's all interesting sounding like that
31	0	a	I think you should say next year one more time Drew !
32	0	a	I guess it ultimately comes down to your investment goals .
33	0	a	I doubt you're even Japanese so you have no reason to be sucking Japan's cock .
34	0	a	The cashier looked at me and asked - ' you're aware this is over 16 ? ' .
35	0	a	If you come back to this could you tell me what restricted item affected people the most .
36	0	a	And i'd love for you to cite me talking shit .
37	0	a	Just a quick search of the word feminism shows they think you're stupid , ugly , worse than cancer , diseased .
38	0	a	I'm disheartened that we have some posters here seemingly wanting to argue with you about your personal experience .
39	0	a	i think part of what you're learning with classes is how to organize code .
40	0	a	I think that perhaps we have found part of the root of the issue regarding your raging anger .
41	0	a	At what point do you just acknowledge you made a mistake ?
42	0	a	I think that makes it even worse , because you might as well have watched a video at that point .
43	0	a	You unsheath your katana and point it to his third chin .
44	0	a	Oh gosh , my deepest condolences for your loss and my most genuine apologies for your repeated experiences .
45	0	a	Congrats on your marriage my man , this was an enjoyable read .
46	1	a	I'm glad we managed to make you laugh !
47	0	a	Thank you :) my friends now are truly amazing and beautiful people .
48	0	a	In my opinion , your relationship with the Gods is your business , my relationship with Them is mine .
49	0	a	Think we both agree on Tuchel being an excellent coach , didn't really mean to disprove your point .
50	0	a	I need to figure out a polite way to say my patience is running thin with your child .
51	0	a	Although in my own personal experience when you ask to have an adult conversation .
52	0	a	The harassment sounds awful , and I'm sorry that it's such a big part of your service .
53	0	a	Run your candidates for office , I encourage it , but don't run a scorched earth campaign .
54	0	a	my only request is that you leave hatred at the door .
55	0	a	Plan a trip back to his home for 3-7 weeks , as your schedule and budget allows .
56	0	a	How dare you tell us where we can instill freedom and other universal rights .
57	0	a	I'm not sure why you insist on believing my antipathy toward HRC must be attributable to her gender .
58	1	a	I'm glad you enjoyed the post , and also relieved my friendly sarcasm wasn't too subtle to notice .
59	0	a	I think you are moralizing and setting your own standard for how we should interact .
60	0	a	I just meant that it's up to you to do so .
61	0	a	So you agree that people identify women based upon their appearance , i . e .
62	0	a	It will be nice to look back on when you lose the next 10 , 20 .. etc .
63	0	a	I cannot imagine how hard it is waiting and waiting for something to work for you , but please keep trying .
64	0	a	I don't see your logic , currently our ISP's must provide equal connection to each service .
65	0	a	Go through my post history if you're really interested but enforcement of business audit / corporate investigation etc .
66	0	a	They'll differ based on different shops so my suggestion is to take a quick look when you see them .
67	0	a	How we draw this distinction will depend upon your views on morality and political-legal justice .
68	0	a	Thanks so much for your insider knowledge i . e .
69	0	a	Never affected our sex life so momma you did everything right .
70	0	a	Man , I get that you don't understand the game but now you're really just coming off as an asshole .
71	0	a	I deserve an apology because you constantly tried to berate me and attack my character .
72	0	a	When someone's actions are directly harming millions of people , why can't you respect my beliefs !
73	0	a	And hope you have a good weekend and stay warm my fellow kiwi !
74	0	a	However , that being said , I respectful disagree with what you say about my last sentence .
75	0	a	Now whoever stole all your paper has no one to hold him accountable .
76	0	a	i wanted you to be a serious candidate but teaming with a democratic socialist is obnoxious .
77	0	a	Sorry for my harsh reaction , but you were condescending for no reason .
78	0	a	Either way , thank you kind stranger , as I have learned my lesson .
79	0	a	look i know you hate us but today we need to stand together as people .
80	0	a	Also my jungler's running a keystone mastery that also does damage so I hope you're ready .
81	0	a	Seeing people like you who've managed to master multiple languages makes me feel both envious and hopeful !
82	0	a	I'm glad that your FH has managed to put on some weight and has a better situation now .
83	0	a	Here's a source from this female engineer : https://code.likeagirl.io/actually-i-was-biologically-designed-to-be-an-engineer-460ab0c377dc > Thank you for a sane , reasonable response .
84	1	a	I thought some of you might enjoy this list and the incredibly entertaining reply posts on the video itself .
85	0	a	Check out your local library - you can check out an internet hot spot for home use .
86	0	a	Like I watch on the app and watch your ads cause I don't have cable .
87	0	a	Some kind stranger used one of my Delta referrals - - thank you !
88	0	a	I'm ok with my job but it's annoying as fuck when your coworkers keep asking are you happy here .
89	0	a	^ ( also avoid if you have a golden retriever - - or at least my golden retriever .
90	0	a	But if I were you , I'd ask him to start parenting the existing children first .
91	0	a	While I appreciate the sentiment , I believe that's more for your benefit than it is for ours .
92	0	a	Thank you , though , for trying to help me lower my blood pressure .
93	0	a	Don't expect the people you know to risk a felony charge just to hook you up .
94	0	a	If we lived in your retarded world , everyone and everything would be coated in bubblewrap .
95	0	a	In my opinion , everything else is easier thanks to the depth perception you get .
96	0	a	I'm just the guy who will do it for you .
97	0	a	I mean , Grrr goons if you want , but this seems completely normal to me .
98	0	a	He pulls out a knife and points it at me and says ' no you get out ' .
99	0	a	I'm on mobile right now so I won't get into the details , but you can read about it here .
100	0	a	Thank you for the answers to my questions !
101	0	a	We can also provide more specific advice if we know what kind of background you have .
102	0	a	I wonder what a mode would play like if you lowered every value to the minimum .
103	0	a	Thank you for responding to my comment ...
104	0	a	I'm not downvoting you , but you seem to not fully appreciate the importance of this particular version of Android .
105	0	a	I'm done discussing this with you , not that it's actually been a discussion .
106	0	a	I was quite cordial in my statements but you seem to be jumping to personal attacks ever so quickly .
107	0	a	We are all in this together and we need you .
108	0	a	For the first 11 years of my life my mom was in a toxic relationship like yours .
109	0	a	In my experience - they can apologize and have moments where they acknowledge that they hurt you .
110	0	a	In the future remember , this sub doesn't love you , you're the problem and we're the solution .
111	0	a	I'll have you know I am a top mod of / r / palemua and have over 9000 confirmed foundation mismatches .
112	0	a	Too bad I'm a patent troll , and your intellectual superiority is my intellectual property .
113	0	a	You can sue the Pope for bastardy if you can afford the filing fee .
114	0	a	Under what conditions you will be willing to respect my claim and I yours is inherently an agreement-based function .
115	0	a	I agree with what you've said , mostly , but wonder why we even speak of social justice .
116	0	a	Violence only breeds more violence , which you know ... is what our government wants .
117	0	a	I appreciate your input , and we definitely want to hear everyone's opinions on the matter .
118	0	a	First and foremost we love your game .
119	0	a	I've sufficiently trampled your stupidity , and had my fun .
120	0	a	But your relationship isn't my business .
121	0	a	I'd also like to point out that your ESRB rating is white .
122	0	a	And yet you insult my knowledge .
123	0	a	I'm in Silver FFS , literally anything that you're good at works .
124	0	a	And , I disagree with your conclusions - we don't need to have a stratified economy .
125	0	a	You just explained exactly what happened when my sister and I tried talking to my mom 1 .
126	0	a	Perhaps seeing my progress will give you some encouragement .
127	0	a	In all seriousness i hope your comment was in jest and not a serious one .
128	0	a	Thank you so much , adding another game to my steam wish list !
129	1	a	Ha , you just reminded me of one of my favorite childhood / Christmas-related memories .
130	0	a	You are probably a full grown adult and you're throwing insults and name calling .
131	0	a	These people are taking advantage of you and they're not going to stop .
132	0	a	You must be a reeeeeedacted r / esist marchagainsttrump libtard since my political affiliation hurts your feelings so bad .
133	0	a	I don't think anyone has a worst this happened in my high school story unless you went to Columbine .
134	0	a	Our school is a great one , and I also think you will love our great fanbase here .
135	0	a	my mom and I both struggle with anxiety and I understand where you're coming from .
136	0	a	By stating that other states also have great breweries now , you basically validated my argument .
137	0	a	Thank you all for challenging my opinion instead of getting mad and yelling at people who disagree with you .
138	0	a	I get it but yeah with a year of advanced notice you'd think people could arrange their schedules .
139	0	a	I knew right away : you guys done fucked up picking this one .
140	0	a	Thank you for taking the time to answer our questions sir .
141	0	a	I get what you are saying , but this is the cost of Secret Service protection for the family .
142	0	a	Regarding your last comments , I definitely regret the increased divisions in our society since the vote .
143	0	a	If you try , I'll file a lis pendens and tie it up in court for months .
144	0	a	And cmon , at least stay consistent with your opinion on my relationship .
145	0	a	Same planet as you , and yet my perspective on life is radically different from yours .
146	0	a	And your deeper answer confirms that we can't know if anything , at all , is true .
147	0	a	Not very fair to the other owner , and benefits you i suppose .
148	0	a	Your parents didn't love you as much as my parents did .
149	0	a	Now you're over here sperging out because i asked you not to use misleading titles .
150	0	a	Please , for the sake of your success and our gaming community , try .
151	0	a	If it's something that bothers you , I definitely recommend looking into braces .
152	0	a	In my experience , the older places offer more privacy in terms of hearing your neighbors .
153	0	a	I don't know how some of you navigate through this .
154	0	a	Nevertheless , I know what thread I'm in so I'll respect your right to be wrong .
155	0	a	Don't use obscure phrases if you're going to get all snooty when someone says ' wtf are you talking about ' .
156	0	a	We believe in transparency so I will try my best to answer all the questions and concerns you have .
157	0	a	A man in your position may have the same experience of their ideas being stolen and their voice ignored .
158	0	a	I think a partial refund would be in order no matter how you feel about the full gallery .
159	0	a	That's not my responsibility , and giving you free stuff is not the responsibility of government .
160	0	a	I will draw it if you will get it tattooed forever on your body .
161	0	a	It's obvious that things are falling apart for you - I think even you can see that .
162	0	a	Thank you for your patience and understanding while we work to prepare for Hurricane Irma .
163	0	a	If you think other allied nations don't benefit from our strength abroad , you're mistaken .
164	0	a	I hope you are working in the art field because you got skills .
165	0	a	And also , you are correct and i'd love to get the thoughts of casting directors ...
166	0	a	Because fuck you I like comedy , and wasting my time that's why .
167	0	a	I really don't know what your message is though to be honest .
168	0	a	In my experience there's not much benefit from hurrying your feelings .
169	0	a	To answer your question , I keep a bowl of kosher salt and a pepper grinder by the stove for cooking .
170	0	a	In all honesty , you need to quit and go work somewhere else .
171	0	a	unless you say rude sexual shit to women in shitty puns you've never fucked one my dude bro .
172	0	a	You don't really buzz for me , and Bill * barely * buzzes , but at least you contribute a fair amount .
173	0	a	Especially when you consider our importance to defending Europe or the balance of power in Asia .
174	0	a	I'm trying to figure out what in game behaviour could possibly qualify as intentional feeding under your system .
175	0	a	I agree , and while our philosophy on gun ownership is different your argument certainly has merit .
176	0	a	None of those people was there at the time , so their judgement may be different from your friend's .
177	0	a	So ... yeah , i can respect your view and disagree with it .
178	0	a	You say ' here is the money ' but they say to you ' I don ’ t want to sell the car . '
179	0	a	Interestingly enough , one of my exes married a guy who looks exactly like you .
180	0	a	I repress much of my childhood but the thought of what you're going through is terrifying .
181	0	a	* ) I'm sitting here with tears in my eyes as I type because caring for something so helpless changes you .
182	0	a	In this circumstance I would seek work elsewhere , but it's your financial situation .
183	0	a	I actually think we agree on the core principle , but I'll note that you were in the Marines .
184	0	a	Ah , well I don't know many Syrians so your personal experience definitely trumps my own speculation .
185	0	a	And it pertained vaguely so sorry you didn't appreciate my input .
186	0	a	And my point was that sometimes relationships change in a way that means you have to leave .
187	0	a	Not saying that's necessarily true for you - but it's worth considering .
188	0	a	Thank you for adding your voice to our community here .
189	0	a	i'm not bitter , i'm just telling you as it is .
190	1	a	Funny when logic and science backs our side you then cry racism .
191	0	a	Then , when you next find yourself at an amusement park , you're that asshole .
192	0	a	my feedback is that you seem to have a tenuous grasp on reality
193	0	a	then I don't know what to say Hey , you never know .
194	0	a	The email you drafted up is exactly like the millions of cold emails that are sent every day .
195	0	a	No matter how much you dislike the president it's important we have good diplomatic relations with the USA .
196	0	a	I need positivity in my life and you guys deliver .
197	1	a	I laugh so hard when people pull stuff like this and say they'll say you raped them .
198	0	a	Thank you very much this made my day !
199	1	a	Fun for drunk trolling if that's your style i guess .
200	0	a	Is that really the kind of friend and family dynamic you want ?
201	0	a	Even through my phone , I can feel the childish disdain in which your posts are steeped .
202	0	a	I wanna point something out here that you may not be thinking about .
203	0	a	That doesn't make me a terrorist , just like it doesn't make you one .
204	0	a	Absurd levels of welfare , benefits , programs , you name it , we give it to them .
205	0	a	love kilims , and i like that your furniture doesn't match , but blends well together .
206	0	a	you look different from what I expected , yet we are both similar .
207	0	a	in fact you just proved my point , you don't have to be a racist to do something racist .
208	0	a	Thank you all for the replies to my sincere question !
209	0	a	But I would like to express my sincere gratification for your contribution of a 40oz bottle of Jack Shit .
210	0	a	Oh and , my condolences for your loss , she looked like a good girl .
211	0	a	I have no horse in this argument , but a response like this just allows people to ( justifiably ) call you ignorant .
212	0	a	The biggest thing in my mind , is that you never brought up why she made the choices she did .
213	0	a	I hope your hubby follows through and gives you some backup , OP , and that you feel better soon .
214	0	a	I mean I assume you're defending Trump since you're providing pics of the packed room .
215	0	a	I think you do not fully understand how Reddit works .
216	0	a	Hope you ease into college life without any issues , thanks for the math advice on my post .
217	0	a	For the most part your organs take up whatever space is available .
218	0	a	Thank you for understanding - - if not all of our reasons , at least for trying .
219	0	a	Paul's always been my favorite Beatle and I'm a little surprised to hear your story - - seems bizarre .
220	0	a	Also something I have noticed because I used to be same way , you are on equal footing with other women .
221	0	a	Honestly with all the injuries our club seems to have been blessed with this year you never know .
222	0	a	Thank you my find chaplin , we now have what we need .
223	0	a	This is your typical how much security vs . freedom do we want as a society .
224	0	a	I don't give a flying fuck your ancestor walked across the plains .
225	0	a	I honestly feel like he is trying to make you the problem .
226	0	a	This is your responsibility as an American : download as much porn as you can .
227	0	a	( mind you I live in South Dakota , being a state that is strict on marijuana )
228	0	a	No matter where this relationship goes , my advice is to own your greatness .
229	0	a	The way you speak and act online speaks multitudes about your personality in my opinion .
230	0	a	Please respect my life and personal choices as I respect yours .
231	0	a	) , so I just want to express my gratitude for whatever hand you might have in that .
232	0	a	If you want secession get the laws that determine our democratic guarantees amended .
233	0	a	No , our entire system won't implode upon itself just because one person you dislike got elected or appointed .
234	0	a	Everybody was responding hey take me off this list please , thank you .
235	0	a	Also , in my experience you cannot combine children from different more groups together .
236	0	a	That's fine , but good luck convincing me to share my bread with you .
237	0	a	Glad to have you as a part of our community !
238	0	a	I'm going to trust my memory of the fight ( and subsequent scenes ) over yours .
239	0	a	Surely , you can understand why we may be hesitant to see such large numbers of the same sigil .
240	0	a	Thank you for being respectful in answering my question .
241	0	a	I don't think you quite grasp how big 2 ^ 512 actually is .
242	1	a	It's my personal fave - you're right , it's super fun .
243	0	a	How dare you challenge my authority , Mr .
244	0	a	In my experience , you have to be able to relate new information to a person's previous understanding .
245	0	a	you post on t_d all the time ... i highly doubt you care about seeing anyone else's perspective .
246	0	a	Also I have no opinion on your personal relationships , my stranger
247	0	a	I would love to keep in contact with you if we both find any good investment opportunities .
248	0	a	You didn't have any lights on , that's what I was telling you .
249	0	a	I think they just get used to you as you and don't want to adjust to new you .
250	0	a	Do you realise that it's just a matter of time till it happens on the other retail stores ?
251	0	a	Thankfully , we don't live in a society defined by people like you .
252	0	a	Later in that post JohnBaku said : UPDATE : I've read all your comments so far and I understand everyone's frustration .
253	0	a	I think what your doing is great but i also think you might need to refine your scope
254	0	a	If you're still clinging to a rebellion that failed 150 years ago get the fuck out of our country .
255	0	a	Now that I hopefully have squeezed past your shitty bar .
256	0	a	American exceptionalism encourages a we mentality , regardless of whether you define it as populist or nationalist .
257	0	a	Yet you point to other people and say they hate our ideals and values .
258	0	a	Shame on you for overestimating our abilities to deny our collective self destructive tendencies .
259	0	a	Also , my university's orthodox services have plenty of women praying thank you very much .
260	0	a	I think you would have to be able to perform critical thinking for that .
261	0	a	If I had one piece of advice for you , plan the wedding you want taking cost into consideration .
262	0	a	If I were hung over after new year's eve , you know what I would do ?
263	0	a	Some of you really change our lives and boost our self esteem !
264	0	a	It does mean saving smartly with whatever you don't spend
265	0	a	They will fight for you ; perhaps our salaries wouldn't take such kicking if more of us were unionised .
266	0	a	But unfortunately we haven't agreed to what those terms are when you have a slice of anonymity .
267	0	a	If you can understand me having faith in the people originally writing them ( i . e .
268	0	a	I would have thought you would be the last person to argue for more government intervention in your life .
269	0	a	Have you not gotten your money's worth out of them ?
270	0	a	You verify the information on the receipts is how you voted .
271	0	a	i continue to be enlightened by your endless wisdom .
272	0	a	Hell , I can get you a physical by 3 o'clock this afternoon .
273	0	a	As you can see on my flair , I love bass .
274	0	a	I am judging you based off your post amd the subsequent comments .
275	0	a	would you make the same comment about someone who died of diabetes ?
276	0	a	I ’ m glad you guys enjoyed it but I honestly can ’ t figure out where the passion and energy have gone .
277	0	a	thank you by the way , i really appreciate all the help .
278	0	a	Thank you very much my Dad will love this !
279	0	a	Oh my god ... thank you for this .
280	0	a	I think you had to know that Mayweather's strategy was to let Conor gas himself and then start working .
281	0	a	Like you say , when he's protecting my dad , it's proper protection .
282	0	a	Its not our fault you are not sharing content like this .
283	0	a	I'm 2 inches taller , 4 pounds lighter , and SO much fluffier than you .
284	0	a	You're actually an idiot and here's why : I saw shallow Hal once on tv .
285	0	a	Yet you believe we are in disagreement .
286	0	a	If you believe we need better evidence based medicine , don't even try reading any parenting books .
287	0	a	you know , in case we get a case of the vapors from the stench of desperation .
288	0	a	Exactly how did you think those plans could be altered so her friend wasn't the third wheel ?
